<?xml version="1.0" encoding="UTF-8"?>
<!DOCTYPE xml>
<devices xmlns="http://www.example.com"
       xmlns:xsi="http://www.w3.org/2001/XMLSchema-instance"
       xsi:schemaLocation="http://www.example.com deviceXSD.xsd">
	<device critical="true">
		<type>
			<group>videocard</group>
			<peripheral>false</peripheral>
			<energyConsumption>90</energyConsumption>
		</type>
		<name>gtx 950</name>
		<origin>USA</origin>
		<price>3000</price>
	</device>
	<device critical="false">
		<type>
			<group>keyboard</group>
			<peripheral>true</peripheral>
			<energyConsumption>10</energyConsumption>
			<port>ps/2</port>
		</type>
		<name>steelseries 7g</name>
		<origin>USA</origin>
		<price>1000</price>
	</device>
	<device critical="true">
		<type>
			<group>processor</group>
			<peripheral>false</peripheral>
			<energyConsumption>13</energyConsumption>
		</type>
		<name>intel core i5</name>
		<origin>USA</origin>
		<price>3500</price>
	</device>
</devices>